ID,Start time,Completion time,Email,Name,Last modified time,Project title (ideally between 3 and 10 words),Short description (ideally one sentence),"People involved (separate by comma only, eg. ""Jinrui Wang,Jenny Long"")",Is this a student-led project?,"Suggest keywords as tag (separate by comma only, capitalise the first letter, eg. ""Physicalisation,Education"")",Project description.,Partners,Project website. (please format links following markdown syntax),"Project Outputs other than Publications. (exhibitions, events, workshops, public engagement) (please format as bullet points, can include links)","Publications. (please format as bullet points, - ""paper title"", please make sure related publication is included in the publication page.)",Thumbnail photo. (ideally a square one),"File name for the thumbnail photo. (e.g., please name as `testproject_thumbnail`.png)","Additional photos for your project. (up to 3, please name as `projectname_1.jpg`,Ê`projectname_2.jpg`)"
1,6/19/26 15:58:04,6/19/26 16:22:23,dkaufma2@ed.ac.uk,Dorsey Kaufmann,,Digital Ghosts,"Exhibition that transforms web archive data into interactive visualizations, revealing how digital content disappears and what those absences tell us about memory, preservation, and loss.","Dorsey Kaufmann, Andrea Kocsis",No,"Digital Humanities, Uncertainty Visualization, Physicalization","Digital Ghosts is a data-driven exhibition that invites audiences to explore and interact with web archive data through a series of visual, tactile, and embodied experiences. The project began with a simple question: how do you visualize disappearance? While web archives are often understood as tools of preservation, they are equally records of loss, capturing traces of websites, communities, and digital cultures that have changed, vanished, or become inaccessible over time.
Most methods for visualizing data are designed around presence - charts, maps, and networks that help us count, compare, and classify what exists. But what happens when the thing we want to understand is missing, fragmented, or decays over time? Rather than treating absence as an error, Digital Ghosts explores how gaps, silences, and missing traces can be made visible and meaningful.
Drawing on web archive datasets from the National Library of Scotland, the exhibition transforms metadata into interactive visualizations, projections, and data physicalisations that reveal patterns of digital decay and preservation. By treating missing data as a meaningful part of the story rather than a flaw to be corrected, the project encourages visitors to consider why certain digital histories disappear, what those absences reveal, and how design can help us understand the fragile and incomplete nature of our online memory.","National Library of Scotland, Feeling Data",https://feelingdata.studio/digital-ghosts/,"¥	Digital Ghosts exhibition in Inspace Gallery. November 2025. https://inspace.ed.ac.uk/digital-ghosts/
¥	Digital Ghosts: Visualising Presence and Absence in ScotlandÕs Web Archives. Workshop 2025. https://inspace.ed.ac.uk/digital-ghosts-visualising-presence-and-absence-in-scotlands-web-archives/
","- ""Designing Digital Ghosts: Creative access to web archives""",https://uoe-my.sharepoint.com/personal/jwang120_ed_ac_uk/Documents/Apps/Microsoft%20Forms/Vishub%20Research%20Projects/Question/Thumbnail_DG_Dorsey%20Kaufmann.png,Thumbnail_DG,https://uoe-my.sharepoint.com/personal/jwang120_ed_ac_uk/Documents/Apps/Microsoft%20Forms/Vishub%20Research%20Projects/Question%201/Digital%20Ghosts_1_Dorsey%20Kaufmann.png; https://uoe-my.sharepoint.com/personal/jwang120_ed_ac_uk/Documents/Apps/Microsoft%20Forms/Vishub%20Research%20Projects/Question%201/Digital%20Ghosts_2_Dorsey%20Kaufmann.png; https://uoe-my.sharepoint.com/personal/jwang120_ed_ac_uk/Documents/Apps/Microsoft%20Forms/Vishub%20Research%20Projects/Question%201/Digital%20Ghosts_3_Dorsey%20Kaufmann.png